,Unnamed: 0,question,answer,category,table_id,explicit,implicit,before_related,after_related,duration_related,max_operator,min_operator,count_operator,sum_operator,difference_operator,average_operator,comparison_operator,ordinal,answer_type
855,855,What year did Marcos Leite win gold in the FIBA AmeriCup games?,1984,ice hockey,579,True,False,False,False,False,False,False,False,False,False,False,False,False,TEMPORAL
856,856,How many year did Marcos Leite playing career last?,22 years,ice hockey,579,True,False,False,False,True,False,False,True,False,False,False,False,False,TEMPORAL
857,857,What college did Marcos Leite play for in 1983?,Pepperdine,ice hockey,579,True,False,False,False,False,False,False,False,False,False,False,False,False,ORGANIZATION
858,858,What team did Marcos Leite play for when he won the Brazilian championship in 1983?,E.C. Sírio,ice hockey,579,True,False,False,False,False,False,False,False,False,False,False,False,False,ORGANIZATION
859,859,In what city did Leite win a bronze medal the same year he became FIBA Intercontinental Cup champion?,San Juan,ice hockey,579,True,False,False,False,False,False,False,False,False,False,False,False,False,PLACE
860,860,How many different times did Marcos Leite play for E.C. Sírio?,3,ice hockey,579,False,True,False,False,False,False,False,True,False,False,False,False,False,COUNT
861,861,What professional team did Leite play for the year he won his first gold medal at the FIBA South American Championship ?,Fluminense,ice hockey,579,True,False,False,False,False,False,False,False,False,False,False,False,True,ORGANIZATION
862,862,In what places did Marcos Leite win bronze medals?,"Philippines, Mexico City and San Juan",ice hockey,579,False,True,False,False,False,False,False,False,False,False,False,False,False,UNKNOWN
863,863,How many years longer was Leite's playing career than his college career?,9,ice hockey,579,True,False,False,False,True,False,False,True,False,False,False,False,False,COUNT
864,864,For what professional team did Antiga play for when won silver at the FIVB World League in Moscow?,CV Pòrtol,volleyball,588,False,True,False,False,False,False,False,False,False,False,False,False,False,ORGANIZATION
865,865,What year did Stéphane Antiga win a silver medal in 2006 Moscow?,FIVB World League,volleyball,588,True,False,False,False,False,False,False,False,False,False,False,False,False,TEMPORAL
866,866,How old was Stéphane Antiga when he won the FIVB World Championship?,26 years old,volleyball,588,False,True,False,False,False,False,False,False,False,False,False,False,False,TEMPORAL
867,867,How many years were between the time Antiga first played professionally and when he began coaching?,20,volleyball,588,True,False,False,False,True,False,False,True,False,False,False,False,True,COUNT
868,868,How old was Antiga when he first played for Paris Volley?,22,volleyball,588,False,True,False,False,False,False,False,False,False,False,False,False,True,AGE
869,869,Which country did Stéphane Antiga lead to gold in 2014?,Poland,volleyball,588,True,False,False,False,False,False,False,True,False,False,False,False,False,PLACE
870,870,How many national teams has Stéphane Antiga coached?,two,volleyball,588,False,True,False,False,False,False,False,True,False,False,False,False,False,COUNT
871,871,What World Championship did Stéphane Antiga win gold?,2014 Poland,volleyball,588,False,True,False,False,False,False,False,False,False,False,False,False,False,UNKNOWN
872,872,How old was Stéphane Antiga the year he medaled in Argentina?,26,volleyball,588,True,False,False,False,False,False,False,False,False,False,False,False,False,AGE
873,873,How long after 20th Century Studios was founded was it owned by Walt Disney?,84 years,company,592,False,True,False,True,False,False,False,False,False,False,False,False,True,TEMPORAL
874,874,How much longer was 20th Century Studios owned by News Corporation than 21st Century Fox?,12 years,company,592,False,True,False,False,True,False,False,False,False,False,False,False,True,TEMPORAL
875,875,"Who was the second owner of 20th Century Studios, Inc.?",News Corporation,company,592,False,True,False,False,False,False,False,False,False,False,False,False,True,PERSON
876,876,How many employees did 20th Century Studios have the year before Walt Disney became its parent company?,"2,300",company,592,True,False,True,False,False,False,False,True,False,False,False,False,True,COUNT
877,877,"Who is the most recent owner of 20th Century Studios, Inc.?",The Walt Disney Company,company,592,False,True,False,False,False,True,False,False,False,False,False,False,True,PERSON
878,878,"Who became the Parent Company of 20th Century Studios, Inc. in 2019?",Walt Disney Studios,company,592,True,False,False,False,False,False,False,False,False,False,False,False,True,PERSON
879,879,"How many employees did 20th Century Studios, Inc. have in 2018?","2,300",company,592,True,False,False,False,False,False,False,True,False,False,False,False,True,COUNT
880,880,"How many years has 20th Century Studios, Inc. been in existence?",87 years,company,592,True,False,False,False,False,False,False,True,False,False,False,False,True,TEMPORAL
881,881,"When did the most recent owner of 20th Century Studios, Inc. acquire the company?",2019,company,592,False,True,False,False,False,True,False,False,False,False,False,False,True,TEMPORAL
882,882,How many years has 888 Holdings PLC been in existence?,25 years,company,595,True,False,False,False,False,False,False,True,False,False,False,False,False,TEMPORAL
883,883,What was the operating income for 888 Holdings PLC in 2021?,$87 Billion,company,595,True,False,False,False,False,False,False,False,False,False,False,False,False,MONEY
884,884,How many employees did 888 Holdings PLC report in 2022?,"1,350",company,595,True,False,False,False,False,False,False,True,False,False,False,False,False,COUNT
885,885,"As of the first month in 2022, how may people were employed by ATT?","203,000",company,597,True,False,False,False,False,False,False,False,False,False,False,False,True,UNKNOWN
886,886,For how many years was ATT known as Southwestern Bell Corporation?,12,company,597,True,False,False,False,True,False,False,True,False,False,False,False,False,COUNT
887,887,for how long has the current ATT logo been in use?,6 years,company,597,False,True,False,False,True,False,False,False,False,False,False,False,False,TEMPORAL
888,888,What was the total revenue for AT&T Inc. in 2021?,$168.86 billion,company,597,True,False,False,False,False,False,False,False,True,False,False,False,False,MONEY
889,889,How long ago was AT&T Inc. founded?,39 years,company,597,False,True,True,False,False,False,False,False,False,False,False,False,False,TEMPORAL
890,890,How long had AT&T been known by a different name?,22 years,company,597,False,True,False,False,False,False,False,False,False,False,False,False,False,TEMPORAL
891,891,What was AT&T Inc. known as prior to 1995?,Southwestern Bell Corporation,company,597,True,False,True,False,False,False,False,False,False,False,False,False,False,UNKNOWN
892,892,What was AT&T known as when September 11th happened?,SBC Communications Inc.,company,597,False,True,False,False,False,False,False,False,False,False,False,False,True,UNKNOWN
893,893,Is there more or less employess at AT&T in 2022 compared to 2021?,less,company,597,True,False,False,False,False,False,False,False,False,False,False,True,False,UNKNOWN
894,894,"what type of industry as a Ambassadors Group, Inc.?",Educational travel,website,600,False,True,False,False,False,False,False,False,False,False,False,False,False,UNKNOWN
895,895,What us total equity of Ambassadors Group in 2009?,US$91.0 million,website,600,True,False,False,False,False,False,False,False,True,False,False,False,False,MONEY
896,896,What is the revenue of Ambassadors Group in 2009?,US$98.6 million,website,600,True,False,False,False,False,False,False,False,False,False,False,False,False,MONEY
897,897,When is Ambassadors Group was founded?,"Spokane, Washington (1967)",website,600,False,True,False,False,False,False,False,False,False,False,False,False,False,UNKNOWN
898,898,How many dollars of Operating income?,$32.2 million,website,600,False,True,False,False,False,False,False,True,False,False,False,False,False,COUNT
899,899,"Which year is founded of Ambassadors Group, Inc?",1967,website,600,True,False,False,False,False,False,False,False,False,False,False,False,False,TEMPORAL
900,900,"Which place founded in Ambassadors Group, Inc?","Spokane, Washington",website,600,False,True,False,False,False,False,False,False,False,False,False,False,False,UNKNOWN
901,901,what is the Revenue of Ambassadors Group?,US$98.6 million,website,600,False,True,False,False,False,False,False,False,False,False,False,False,False,MONEY
902,902,"where is founded of Ambassadors Group, Inc.?",Spokane,website,600,False,True,False,False,False,False,False,False,False,False,False,False,False,PLACE
903,903,How many students were there in University of Cambridge during the year 2020?,"24,450",university,606,True,False,False,False,True,False,False,True,False,False,False,False,False,COUNT
904,904,"Which is greater, the age of the University of Cambridge or its amount of acres?",age,university,606,False,True,False,False,False,False,False,False,False,False,False,False,False,UNKNOWN
905,905,When was the University of Cambridge was established?, 1209,university,606,False,True,False,False,False,False,False,False,False,False,False,False,False,TEMPORAL
906,906,How many Academic staff in 2020 at University of Cambridge?,6170,university,606,True,False,False,False,False,False,False,True,False,False,False,False,False,COUNT
907,907,How many years ago University of Cambridge Founded?,813 years ago,university,606,True,False,True,False,False,False,False,True,False,False,False,False,False,TEMPORAL
908,908,What was the name of University of Cambridge in 1209?,"The Chancellor, Masters and Scholars of the University of Cambridge",university,606,True,False,False,False,False,False,False,False,False,False,False,False,False,ORGANIZATION
909,909,When was University of Cambridge founded?,1209,university,606,False,True,False,False,False,False,False,False,False,False,False,False,False,TEMPORAL
910,910,What was the total students for University of Cambridge in 2020?,"24,450",university,606,True,False,False,False,False,False,False,False,True,False,False,False,False,UNKNOWN
911,911,What is the total of undergraduates and postgraduates	at the University of Cambridge?,"24,450",university,606,False,True,False,False,False,False,False,False,True,False,False,False,False,UNKNOWN
912,912,Who was the Vice Chancellor of University of Cambridge?,Stephen J. Toope,university,606,False,True,False,False,False,False,False,False,False,False,False,False,False,PERSON
913,913,When was the University of Cambridge established?,1209 AD,university,606,False,True,False,False,False,False,False,False,False,False,False,False,False,TEMPORAL
914,914,How many academic affiliations does the University of Cambridge have?,seven,university,606,False,True,False,False,False,False,False,True,False,False,False,False,False,COUNT
915,915,How many more academic affiliations than sporting affiliations does Yale University have?,one,university,611,False,True,False,False,False,False,False,True,False,False,False,True,False,COUNT
916,916,How many languages are Yale University's mottos in?,two,university,611,False,True,False,False,False,False,False,True,False,False,False,False,False,COUNT
917,917,How many years was Yale University known as Collegiate School?,17 years,university,611,True,False,False,False,False,False,False,True,False,False,False,False,False,TEMPORAL
918,918,How many students studied in Yale University 2020?,12060,university,611,True,False,False,False,False,False,False,True,False,False,False,False,False,COUNT
919,919,How many years ago did Collegiate School was named Yale College?,304 years ago,university,611,True,False,True,False,False,False,False,True,False,False,False,False,False,TEMPORAL
920,920,What is the total of Yale University's academic staff and students?,"16,929",university,611,False,True,False,False,False,False,False,False,True,False,False,False,False,UNKNOWN
921,921,How many years did Yale University was named Collegiate School?,17 Years,university,611,True,False,False,False,False,False,False,True,False,False,False,False,False,TEMPORAL
922,922,What was the name of Yale University in 1701?,Collegiate School,university,611,True,False,False,False,False,False,False,False,False,False,False,False,False,UNKNOWN
923,923,How many years has Yale University been in existance?,321 years,university,611,True,False,False,False,False,False,False,True,False,False,False,False,False,TEMPORAL
924,924,Can more people attend basketball games or concerts at the Carrier Dome?,concerts,stadium,621,False,True,False,False,False,False,False,False,False,False,False,True,False,UNKNOWN
925,925,How many years passed between the ground breaking and the opening of the Carrier Dome?,2,stadium,621,True,False,False,False,True,False,False,True,False,False,False,False,False,COUNT
926,926,In what decade was the capacity of the Carrier Dome the greatest?,80s,stadium,621,True,False,False,False,False,False,False,False,False,False,False,False,False,UNKNOWN
927,927,How many more undergraduates than postgraduates does Jacobs University Bremen have?,898,university,624,False,True,False,False,False,False,False,True,False,False,False,True,False,COUNT
928,928,How many years ago this Jacobs University Bremen Established?,21 years ago,university,624,True,False,True,False,False,False,False,True,False,False,False,False,False,TEMPORAL
929,929,"Which is greater, the amount of Jacobs University Bremen's postgraduates	or doctoral students?",doctoral students,university,624,False,True,False,False,False,False,False,False,False,False,False,False,False,UNKNOWN
930,930,How many more doctoral students than post grads does Jacobs University have?,41,university,624,False,True,False,False,False,False,False,True,False,False,False,True,False,COUNT
931,931,How many professors does Jacobs University have?,62,university,624,False,True,False,False,False,False,False,True,False,False,False,False,False,COUNT
932,932,When was Jacobs university founded?,2001,university,624,False,True,False,False,False,False,False,False,False,False,False,False,False,TEMPORAL
933,933,How many Undergraduates and Postgraduates studied at Jacobs University Bremen in 2020?,1286,university,624,True,False,False,False,False,False,False,True,False,False,False,False,False,COUNT
934,934,"Which is greater, the amount of Jacobs University Bremen's professors or doctoral students?",doctoral students,university,624,False,True,False,False,False,False,False,False,False,False,False,False,False,UNKNOWN
935,935,How many academic staff excluded Professors are working at Jacobs University Bremen in 2020?,188,university,624,True,False,False,False,False,False,False,True,False,False,False,False,False,COUNT
936,936,How long did it take for NYSE to go from US$20.161 trillion volume to US$26.2 trillion marketcap?,10 years,monument,626,False,True,False,False,False,False,False,False,False,False,False,False,False,TEMPORAL
937,937,How many years after finding NYSE was its volume US$20.161 trillion?,219 years,monument,626,True,False,False,True,False,False,False,True,False,False,False,False,False,TEMPORAL
938,938,"After how many years of finding the NYSE, did its market cap reach $26.2 trillion?",229 years,monument,626,True,False,False,False,True,False,False,True,False,False,False,False,False,TEMPORAL
939,939,What was the opening date of the New York Stock Exchange?,"May 17, 1792",monument,626,False,True,False,False,False,False,False,False,False,True,False,False,False,TEMPORAL
940,940,What year was the New York Stock Exchange founded?,1792,monument,626,True,False,False,False,False,False,False,False,False,True,False,False,False,TEMPORAL
941,941,What was the market cap for the New York Stock Exchange in 2021?,$26.2 trillion,monument,626,True,False,False,False,False,False,False,False,False,True,False,False,False,MONEY
942,942,What is the Market cap  volume difference betwwen 2011-2021?,US$6.039 trillion,monument,626,True,False,False,False,False,False,False,False,False,True,False,False,False,MONEY
943,943,How many years ago this New York Stock Exchange Founded?,229 years ago,monument,626,True,False,True,False,False,False,False,True,False,True,False,False,False,TEMPORAL
944,944,In what year was the NYSE founded?,1792,monument,626,True,False,False,False,False,False,False,False,False,False,False,False,False,TEMPORAL
945,945,Who is the chairman of New York Stock Exchange in 2022?,Jeffrey Sprecher,monument,626,True,False,False,False,False,False,False,False,False,True,False,False,False,PERSON
946,946,How many listings does the NYSE have?,2400,monument,626,False,True,False,False,False,False,False,True,False,False,False,False,False,COUNT
947,947,What currency does the NYSE trade in?,US dollar,monument,626,False,True,False,False,False,False,False,False,False,False,False,False,False,UNKNOWN
948,948,Was the stadium called Tractor Stadium or Dzerzhinets Stadium for a longer period of time?,Dzerzhinets Stadium,stadium,627,False,True,False,False,True,False,False,False,False,False,False,False,False,UNKNOWN
949,949,How many years was the stadium called Tractor Stadium?,14,stadium,627,True,False,False,False,False,False,False,True,False,False,False,False,False,COUNT
950,950,What is the capacity of OSC Metalist stadium?,"41,307",stadium,627,False,True,False,False,False,False,False,False,False,False,False,False,False,UNKNOWN
951,951,How many name changes has OSC Metalist stadium had?,3,stadium,627,False,True,False,False,False,False,False,True,False,True,False,False,False,COUNT
952,952,When did OSC Metalist Stadium first open?,1926,stadium,627,False,True,False,False,False,False,False,False,False,False,False,False,True,TEMPORAL
953,953,How long after breaking ground did OSC Metalist open?,1 year,stadium,627,False,True,False,True,False,False,False,False,False,False,False,False,False,TEMPORAL
954,954,How many years after opening was OSC Metalist renovated?,83 years,stadium,627,True,False,False,True,False,False,False,True,False,False,False,False,False,TEMPORAL
955,955,What was the name of OSC Metalist 25 years after its opening?,Dzerzhinets Stadium,stadium,627,True,False,False,True,False,False,False,False,False,False,False,False,False,UNKNOWN
956,956,How many years after opening was the stadium renovated?,83,stadium,627,True,False,False,True,False,False,False,True,False,False,False,False,False,COUNT
957,957,When was second Launch Pad became operational?,5 May 2005,launchpad,628,False,True,False,False,False,False,False,False,False,False,False,False,True,TEMPORAL
958,958,How many Launches did Satish Dhawan Space Centre (SDSC) completed?,83,launchpad,628,False,True,False,False,False,False,False,True,False,False,False,False,False,COUNT
959,959,How many years after the first launch at the Satish Dhawan Space Centre did the first launch from its second launch pad occur?,26,launchpad,628,True,False,False,True,False,False,False,True,False,False,False,False,True,COUNT
960,960,In what year did the first launch occur at the Satish Dhawan Space Centre?,1979,launchpad,628,True,False,False,False,False,False,False,False,False,False,False,False,True,TEMPORAL
961,961,How many launch pads are at the Satish Dhawan Space Centre?,3,launchpad,628,False,True,False,False,False,False,False,True,False,False,False,False,False,COUNT
962,962,Who is the chairman of Satish Dhawan Space Centre?,Shri A Rajarajan,launchpad,628,False,True,False,False,False,False,False,False,False,False,False,False,False,PERSON
963,963,Which year Satish Dhawan Space Centre named?,2002,launchpad,628,True,False,False,False,False,False,False,False,False,False,False,False,False,TEMPORAL
964,964,Where did Satish Dhawan Space Centre located?,Sriharikota,launchpad,628,False,True,False,False,False,False,False,False,False,False,False,False,False,PLACE
965,965,How many Launch Pads are there?,3,launchpad,628,False,True,False,False,False,False,False,True,False,False,False,False,False,COUNT
966,966,Which year is last launch?,1991,launchpad,629,True,False,True,False,False,False,False,False,False,False,False,False,True,TEMPORAL
967,967,How many proton launchces?,63,launchpad,629,False,True,False,False,False,False,False,True,False,False,False,False,False,COUNT
968,968,Which year is first launch?,1977,launchpad,629,True,False,False,False,False,False,False,False,False,False,False,False,True,TEMPORAL
969,969,What year did the first launch from Site 200 occur?,1980,launchpad,629,True,False,False,False,False,False,False,False,False,False,False,False,True,TEMPORAL
970,970,How many launches occurred at Site 200/40 in total?,63,launchpad,629,False,True,False,False,False,False,False,True,True,False,False,False,False,COUNT
971,971,How many launch pads are at Site 200?,2,launchpad,629,False,True,False,False,False,False,False,True,False,False,False,False,False,COUNT
972,972,What was the time difference between the first launch and the last launch at 200/39?,Almost 22 years,launchpad,629,True,False,True,False,True,False,False,False,False,True,False,False,True,TEMPORAL
973,973,What was the time difference between the first and last launch at the site 200/40 site?,Almost 14 years,launchpad,629,True,False,True,False,True,False,False,False,False,True,False,False,True,TEMPORAL
974,974,Which site had multiple associated rockets?,Site 200/39,launchpad,629,False,True,False,False,False,False,False,False,False,False,False,False,False,UNKNOWN
975,975,what is the products of the West Stanley Pit?,coal,event,634,False,True,False,False,False,False,False,False,False,False,False,False,False,UNKNOWN
976,976,how many death occur in West Stanley Pit?,168,event,634,False,True,False,False,False,False,False,True,False,False,False,False,False,COUNT
977,977,what is the depth of West Stanley Pit?,163 fathoms 1882 disaster,event,634,False,True,False,False,False,False,False,False,False,False,False,False,False,UNKNOWN
978,978,Which location  occurred of West Stanley Pit?,Durham,event,634,False,True,False,False,False,False,False,False,False,False,False,False,False,PLACE
979,979,How many deaths of West Stanley Pit?,13,event,634,False,True,False,False,False,False,False,True,False,False,False,False,False,COUNT
980,980,when did the inquest was occuring?,26 and 27 April 1882.,event,634,False,True,False,False,False,False,False,False,False,False,False,False,False,TEMPORAL
981,981,What is the depth of the disaster?,The depth of disaster is 163 fathoms.,event,634,False,True,False,False,False,False,False,False,False,False,False,False,False,UNKNOWN
982,982,Which country occurred of West Stanley Pit?,United Kingdom,event,634,False,True,False,False,False,False,False,True,False,False,False,False,False,PLACE
983,983,What is the death rate in West Stanley Pit disaster?,Totally 13 deaths in West Stanley Pit disaster.,event,634,False,True,False,False,False,False,False,False,False,False,False,False,False,UNKNOWN
984,984,When was the last time that Blaze Riorden won a medal at the World Indoor Lacrosse Championship?,2019,lacrosse,642,False,True,True,False,False,False,False,False,False,False,False,False,True,TEMPORAL
985,985,How many years apart were the medals that Blaze Riorden won at the World Indoor Lacrosse Championship?,4 years,lacrosse,642,True,False,False,False,False,False,False,True,False,False,False,False,False,TEMPORAL
986,986,When was the most recent time that Blaze Riorden was an all star in the PLL?,2021,lacrosse,642,False,True,False,False,False,True,False,False,False,False,False,False,False,TEMPORAL
987,987,How many times did Blaze Riorden was won Oren Lyons Goalie of the Year from 2019?,3 Times,lacrosse,642,True,False,False,False,False,False,False,True,False,False,False,False,False,COUNT
988,988,Which team did Blaze Riorden was played in 2016?,Albany,lacrosse,642,True,False,False,False,False,False,False,False,False,False,False,False,False,ORGANIZATION
989,989,How many titles did Blaze Riorden earn between 2016 and 2021?,9,lacrosse,642,True,False,False,False,True,False,False,True,False,False,False,False,False,COUNT
990,990,What was the age when Blaze Riorden won America East Defensive Player of the Year in 2016?,Age of 22,lacrosse,642,True,False,False,False,False,False,False,False,False,False,False,False,False,AGE
991,991,What league was Blaze Riorden playing for when he won the World Indoor Lacrosse Championship in Langley?,PLL,lacrosse,642,False,True,False,False,False,False,False,False,False,False,False,False,False,UNKNOWN
992,992,Where did Blaze Riorden compete in the World Lacrosse Championship when he won the First Team All America East for the second time?,Onondaga,lacrosse,642,False,True,False,False,False,False,False,False,False,False,False,False,True,PLACE
993,993,How many years ago Brandon Miller career started?,21 Years ago,lacrosse,644,True,False,True,False,False,False,False,True,False,False,False,False,False,TEMPORAL
994,994,How many times did Brandon Miller awarded Harry Lumley Trophy from 2008?,2 Times,lacrosse,644,True,False,False,False,False,False,False,True,False,False,False,False,False,COUNT
995,995,When was the first time that Brandon Miller was the Mann Cup Champion?,2002,lacrosse,644,False,True,False,False,False,False,False,False,False,False,False,False,True,TEMPORAL
996,996,How long was it between when Brandon Miller won the Harry Lumley Trophy the first time and the last time?,12 years,lacrosse,644,False,True,True,False,True,False,False,False,False,False,False,False,True,TEMPORAL
997,997,What was the age when Brandon Miller won NLL All-Star award in 2007?,Age of 28,lacrosse,644,True,False,False,False,False,False,False,False,False,False,False,False,False,AGE
998,998,What years did Brandon Miller win more than one award?,"2007, 2008, 2013, 2014",lacrosse,644,True,False,False,False,False,False,False,False,False,False,False,True,False,TEMPORAL
