,Unnamed: 0,question,answer,category,table_id,explicit,implicit,before_related,after_related,duration_related,max_operator,min_operator,count_operator,sum_operator,difference_operator,average_operator,comparison_operator,ordinal,answer_type
422,422,Where was Jeffrey Epstein born?,New York City,person,340,False,True,False,False,False,False,False,False,False,False,False,False,False,PLACE
423,423,What was Nicki Minaj given birth name in 1982?,Onika Tanya Maraj,musician,347,True,False,False,False,False,False,True,False,False,False,False,False,False,UNKNOWN
424,424,How old was Nicki Minaj when she married Kenneth Petty in 2019?,37 years old,musician,347,True,False,False,False,False,False,True,False,False,False,False,False,False,TEMPORAL
425,425,For how many years was Nicki Minaj with her second partner?,3,musician,347,True,False,False,False,True,False,True,True,False,False,False,False,True,COUNT
426,426,How long was Nicki Minaj with her first partner when she started performing?,4 years,musician,347,False,True,False,False,False,False,True,False,False,False,False,False,True,TEMPORAL
427,427,How many years has Nicki Minaj been active in her career?,18 years,musician,347,True,False,False,False,False,False,True,True,False,False,False,False,False,TEMPORAL
428,428,How old was Minaj when her career began?,22,musician,347,False,True,False,False,False,False,True,False,False,False,False,False,False,AGE
429,429,How long after Minaj's career began did she marry Kenneth Petty?,15 years,musician,347,False,True,False,True,False,False,True,False,False,False,False,False,False,TEMPORAL
430,430,How old was Nicki Minaj when she ended her partnership with Safaree Samuels?,32,musician,347,False,True,False,False,False,False,True,False,False,False,False,False,False,AGE
431,431,How many years between Nicki Minaj's relationship between Safaree Samuels and Meek Mill?,One year.,musician,347,True,False,False,False,True,False,True,True,False,False,False,False,False,TEMPORAL
432,432,How old was Nicki Minaj when she got married?,36,musician,347,False,True,False,False,False,False,True,False,False,False,False,False,False,AGE
433,433,When did Nicki Minaj break up with her first partner?,2014,musician,347,False,True,False,False,False,False,True,False,False,False,False,False,True,TEMPORAL
434,434,How much longer did Minaj's relationship with Safaree Samuels last than with Meek Mill?,12 years,musician,347,False,True,True,False,True,False,True,False,False,False,False,False,True,TEMPORAL
435,435,How many years was Paul Gauguin married to Teha'amana?,2,painter,349,True,False,False,False,False,False,False,True,False,False,False,False,False,COUNT
436,436,What age did Paul Gauguin die at?,54,painter,349,False,True,False,False,False,False,False,False,False,False,False,False,False,AGE
437,437,How many times was Paul Gauguin married?,2,painter,349,False,True,False,False,False,False,False,True,False,False,False,False,False,COUNT
438,438,How many years ago did Paul Gauguin die?,119,painter,349,True,False,True,False,False,False,False,True,False,False,False,False,False,COUNT
439,439,At what age Paul Gauguin married Mette-Sophie Gad?,25,painter,349,False,True,False,False,False,False,False,False,False,False,False,False,False,AGE
440,440,At what age Paul Gauguin seperated Mette-Sophie Gad?,46,painter,349,False,True,False,False,False,False,False,False,False,False,False,False,False,AGE
441,441,At what age Paul Gauguin seperated Teha'amana?,45,painter,349,False,True,False,False,False,False,False,False,False,False,False,False,False,AGE
442,442,To whom was Paul Gauguin’s longest marriage?,Mette-Sophie Gad,painter,349,False,True,False,False,False,False,False,False,False,False,False,False,False,UNKNOWN
443,443,How many years was Paul Gauguin married to Mette-Sophie Gad?,21,painter,349,True,False,False,False,False,False,False,True,False,False,False,False,False,COUNT
444,444,What is the Notable work by Pierre Auguste Cot in 1873?,Springtime,painter,350,True,False,False,False,False,False,False,False,False,False,False,False,False,UNKNOWN
445,445,How old was Pierre Auguste Cot when he died?,46,painter,350,False,True,False,False,False,False,False,False,False,False,False,False,False,AGE
446,446,When did Pierre Auguste Cot write The Storm?,He wrote the storm in 1880.,painter,350,False,True,False,False,False,False,False,False,False,False,False,False,False,TEMPORAL
447,447,How old was Pierre Auguste Cot at his death?,46,painter,350,False,True,False,False,False,False,False,False,False,False,False,False,False,AGE
448,448,When did Pierre Auguste Cot write Springtime?,He wrote springtime in 1873.,painter,350,False,True,False,False,False,False,False,False,False,False,False,False,False,TEMPORAL
449,449,How old was Pierre Auguste Cot when he painted The Storm?,43,painter,350,False,True,False,False,False,False,False,False,False,False,False,False,False,AGE
450,450,In what year was Pierre Auguste Cot born?,1837,painter,350,True,False,False,False,False,False,False,False,False,False,False,False,False,TEMPORAL
451,451,What is the date of birth of Pierre Auguste Cot?,17 February 1837,painter,350,False,True,False,False,False,False,False,False,False,False,False,False,False,TEMPORAL
452,452,When was Pierre Auguste Cot born?,"Pierre Auguste Cot was born on February 17, 1873.",painter,350,False,True,False,False,False,False,False,False,False,False,False,False,False,TEMPORAL
453,453,At what age did Pierre Auguste Cot finish The Storm?,43,painter,350,False,True,False,False,False,False,False,False,False,False,False,False,False,AGE
454,454,What painting did Pierre Auguste Cot finish three years before his death?,The Storm,painter,350,True,False,True,False,False,False,False,False,False,False,False,False,False,UNKNOWN
455,455,What painting did Pierre Auguste Cot finish at the age of 36?,Springtime,painter,350,False,True,False,False,False,False,False,False,False,False,False,False,False,UNKNOWN
456,456,At what age Stephen Hawking married Jane Wilde?,23,nobel,352,False,True,False,False,False,False,False,False,False,False,False,False,False,AGE
457,457,At what age Stephen Hawking divorced Jane Wilde?,53,nobel,352,False,True,False,False,False,False,False,False,False,False,False,False,False,AGE
458,458,At what age Stephen Hawking married Elaine Mason?,53,nobel,352,False,True,False,False,False,False,False,False,False,False,False,False,False,AGE
459,459,How old was Stephen Hawking when he wrote his Thesis in 1966?,24 years old,nobel,352,True,False,False,False,False,False,False,False,False,False,False,False,False,TEMPORAL
460,460,How many years ago did Stephen Hawking was died?,4 Year ago,nobel,352,True,False,True,False,False,False,False,True,False,False,False,False,False,TEMPORAL
461,461,How many awards won by Stephen Hawking in 1976?,Three,nobel,352,True,False,False,False,False,False,False,True,False,False,False,False,False,COUNT
462,462,What medal did Stephen Hawking win in 1966?,Adams Prize,nobel,352,True,False,False,False,False,False,False,False,False,False,False,False,False,PRODUCT
463,463,What year did Stephen Hawking win the Presidential Medal of Freedom?,2009,nobel,352,True,False,False,False,False,False,False,False,False,False,False,False,False,TEMPORAL
464,464,How old was Stephen Hawking when he married his first wife in 1965?,23 years old,nobel,352,True,False,False,False,False,False,False,False,False,False,False,False,True,TEMPORAL
465,465,How many years before Stephen Hawking died did he win the Copley Medal?,12,nobel,352,True,False,True,False,False,False,False,True,False,False,False,False,False,COUNT
466,466,At what age did Stephen Hawking divorce his first wife?,53,nobel,352,False,True,False,False,False,False,False,False,False,False,False,False,True,AGE
467,467,How many years did Stephen Hawking and Jane Wilde was married relatioship?,30 years,nobel,352,True,False,False,False,False,False,False,True,False,False,False,False,False,TEMPORAL
468,468,How many years ago did Stephen Hawking released the Properties of Expanding Universes?,56 Years ago,nobel,352,True,False,True,False,False,False,False,True,False,False,False,False,False,TEMPORAL
469,469,What was Stephen Hawking's Thesis title he wrote in 1966?,Properties of Expanding Universes,nobel,352,True,False,False,False,False,False,False,False,False,False,False,False,False,UNKNOWN
470,470,How old was Stephen Hawking when he was awarded the BBVA Foundation Frontiers of Knowledge Award in 2015?,73 years old,nobel,352,True,False,False,False,False,False,False,False,False,False,False,False,False,TEMPORAL
471,471,At what age did Stephen Hawking win the Hughs Medal?,34,nobel,352,False,True,False,False,False,False,False,False,False,False,False,False,False,AGE
472,472,How old was Stephen Hawking when he died?,76,nobel,352,False,True,False,False,False,False,False,False,False,False,False,False,False,AGE
473,473,How many Albert Einstein Award won by Stephen Hawking from 1966-2015?,Two,nobel,352,True,False,False,False,False,False,False,True,False,False,False,False,False,COUNT
474,474,At what age did Steve Jobs become active in his career?,21,person,353,False,True,False,False,False,False,False,False,False,False,False,False,False,AGE
475,475,How many years after becoming active did Steve Jobs get married?,15,person,353,True,False,False,True,False,False,True,True,False,False,False,False,False,COUNT
476,476,How many children's Steven Paul jobs have?,4,person,353,False,True,False,False,False,False,False,True,False,False,False,False,False,COUNT
477,477,Chrisann Brennan and Steven Paul jobs are Partner for how long?,5,person,353,False,True,False,False,True,False,False,False,False,False,False,False,False,UNKNOWN
478,478,How many years ago did Steve Jobs was died?,11 years ago,person,353,True,False,True,False,False,False,False,True,False,False,False,False,False,TEMPORAL
479,479,What is the age of Steve Jobs when married Laurene Powell​?,Age of 36,person,353,False,True,False,False,False,False,False,False,False,False,False,False,False,AGE
480,480,How many years ago did Steve Jobs presenting the iPhone 4?,12 Years ago,person,353,True,False,True,False,False,False,False,True,False,False,False,False,False,TEMPORAL
481,481,At what age did Steve Jobs marry his spouse?,36,person,353,False,True,False,False,False,False,False,False,False,False,False,False,False,AGE
482,482,Steven Paul Jobs at what age marry Laurene Powell?,36,person,353,False,True,False,False,False,False,False,False,False,False,False,False,False,UNKNOWN
483,483,At what age did Steve Jobs end his partnership with Chrisann Brennan?,22,person,353,False,True,False,False,False,False,False,False,False,False,False,False,False,AGE
484,484,How many years was Steve Jobs active in his career?,35 years,person,353,True,False,False,False,False,False,False,True,False,False,False,False,False,TEMPORAL
485,485,Steven Paul Jobs at what age marry Laurene Powell?,36,person,353,False,True,False,False,False,False,False,False,False,False,False,False,False,UNKNOWN
486,486,How many years Steven Paul Jobs and Chrisann Brennan are partners?,5,person,353,True,False,False,False,False,False,False,True,False,False,False,False,False,COUNT
487,487,Steven Paul Jobs have been board member of how many companies?,2,person,353,False,True,False,False,False,False,False,True,False,False,False,False,False,COUNT
488,488,How many years after first becoming active did Steve Jobs get married?,15,person,353,True,False,False,True,False,False,True,True,False,False,False,False,True,COUNT
489,489,How many years was Steve Jobs in a relationship with his partner Chrisann Brennan?,5 years,person,353,True,False,False,False,False,False,False,True,False,False,False,False,False,TEMPORAL
490,490,How old was Steve Jobs when he married Laurene Powell in 1991​?,36 years old,person,353,True,False,False,False,False,False,False,False,False,False,False,False,False,TEMPORAL
491,491,At what age did Steve Jobs first have a partner?,17,person,353,False,True,False,False,False,False,False,False,False,False,False,False,True,AGE
492,492,"What is the year of his notable work ""The Gross Clinic""?",1875,painter,356,True,False,False,False,False,False,False,False,False,False,False,False,False,TEMPORAL
493,493,How old was Thomas Eakins when he died?,71,painter,356,False,True,False,False,False,False,False,False,False,False,False,False,False,AGE
494,494,What was the name of the painting that Thomas Eakins painted in 1908?,William Rush and His Model,painter,356,True,False,False,False,False,False,False,False,False,False,False,False,False,UNKNOWN
495,495,What year did Thomas Eakins paint The Gross Clinic?,1875,painter,356,True,False,False,False,False,False,False,False,False,False,False,False,False,TEMPORAL
496,496,How old was Thomas Eakins when he painted Max Schmitt in a Single Scull?,27 years old,painter,356,False,True,False,False,False,True,False,False,False,False,False,False,False,TEMPORAL
497,497,At what age his work The Agnew Clinic Clinic came?,45,painter,356,False,True,False,False,False,False,False,False,False,False,False,False,False,AGE
498,498,At what age Thomas Eakins die?,71,painter,356,False,True,False,False,False,False,False,False,False,False,False,False,False,AGE
499,499,Where was Thomas Eakins born in 1844?,"Philadelphia, Pennsylvania, United States",painter,356,True,False,False,False,False,False,False,False,False,False,False,False,False,PLACE
500,500,At what age his work The Gross Clinic came?,31,painter,356,False,True,False,False,False,False,False,False,False,False,False,False,False,AGE
501,501,What was the first award that Alimuddin Zumla won?,Weber-Parkes Trust Medal,scientist,364,False,True,False,False,False,False,False,False,False,False,False,False,True,UNKNOWN
502,502,How many awards has Alimuddin Zumla won in the last ten years?,6,scientist,364,True,False,True,False,False,False,False,True,False,False,False,False,True,COUNT
503,503,How old was Alimuddin Zumla when he won the 2021 EU-EDCTP Pascoal Mocumbi Prize?,66 years old,scientist,364,True,False,False,False,False,False,False,False,False,False,False,False,False,TEMPORAL
504,504,How old was Alimuddin Zumla when he won the 1999  Weber-Parkes Trust Medal?,45 years old,scientist,364,True,False,False,False,False,False,False,False,False,False,False,False,False,TEMPORAL
505,505,What year did Alimuddin Zumla win the Union Medal?,2018,scientist,364,True,False,False,False,False,False,False,False,False,False,False,False,False,TEMPORAL
506,506,What was the name of the most recent award that Alimuddin Zumla received?,EU-EDCTP Pascoal Mocumbi Prize,scientist,364,False,True,False,False,False,True,False,False,False,False,False,False,False,UNKNOWN
507,507,How old was Zumla when he won the Mahathir Science Award?,65,scientist,364,False,True,False,False,False,False,False,False,False,False,False,False,False,AGE
508,508,How long after Zumla wrote his thesis did he win the  Weber-Parkes Trust Medal?,12 years,scientist,364,False,True,False,True,False,False,False,False,False,False,False,False,False,TEMPORAL
509,509,How many years are between when Zumla won the EU-EDCTP Pascoal Mocumbi Prize and the Karolinska Institutet Science Award?,9,scientist,364,True,False,False,False,True,False,False,True,False,False,False,False,False,COUNT
510,510,How many awards did he win?,4,nobel,369,False,True,False,False,False,False,False,True,False,False,False,False,False,COUNT
511,511,Who did Adolf von Baeyer marry in 1868?,Adelheid Bendemann,nobel,369,True,False,False,False,False,False,False,False,False,False,False,False,False,PERSON
512,512,What award did Adolf von Baeyer receive in 1903?,Liebig Medal,nobel,369,True,False,False,False,False,False,False,False,False,False,False,False,False,UNKNOWN
513,513,How old was Adolf von Baeyer when he won the Nobel Prize for Chemistry?,70 years old,nobel,369,False,True,False,False,False,False,False,False,False,False,False,False,False,TEMPORAL
514,514,At what age Adolf von Baeyer married Adelheid Bendemann?,32,nobel,369,False,True,False,False,False,False,False,False,False,False,False,False,False,AGE
515,515,At what age does Adolf von Baeyer receive Nobel Prize?,69,nobel,369,False,True,False,False,False,False,False,False,False,False,False,False,False,AGE
516,516,how many children's Adolf von Baeyer have?,3,nobel,369,False,True,False,False,False,False,False,True,False,False,False,False,False,COUNT
517,517,How old was he when he won the Nobel?,70,nobel,369,False,True,False,False,False,False,False,False,False,False,False,False,False,AGE
518,518,How old was he when he got married?,33,nobel,369,False,True,False,False,False,False,False,False,False,False,False,False,False,AGE
519,519,How old was Adolf von Baeyer when he got married?,33 years old,nobel,369,False,True,False,False,False,False,False,False,False,False,False,False,False,TEMPORAL
520,520,How many years before his death did Adolf von Baeyer win the Nobel Prize in Chemistry?,12 years,nobel,369,True,False,True,False,False,False,False,True,False,False,False,False,False,TEMPORAL
521,521,How long had Adolf von Baeyer been married when he won the Davy Medal?,13 years,nobel,369,False,True,False,False,False,False,False,False,False,False,False,False,False,TEMPORAL
522,522,At what age Adolf von Baeyer married Adelheid Bendemann?,32,nobel,369,False,True,False,False,False,False,False,False,False,False,False,False,False,AGE
523,523,At what age does Adolf von Baeyer received Nobel Prize?,69,nobel,369,False,True,False,False,False,False,False,False,False,False,False,False,False,AGE
524,524,How many children's did Adolf von Baeyer have?,3,nobel,369,False,True,False,False,False,False,False,True,False,False,False,False,False,COUNT
525,525,How many years before Johann Friedrich Wilhelm Adolf Baeyer's death did he win the Nobel Prize for Chemistry?,12,nobel,369,True,False,True,False,False,False,False,True,False,False,False,False,False,COUNT
526,526,At what age did Johann Friedrich Wilhelm Adolf Baeyer win the Davy Medal?,51,nobel,369,False,True,False,False,False,False,False,False,False,False,False,False,False,AGE
527,527,How many years after marrying his spouse did Johann Friedrich Wilhelm Adolf Baeyer win the Liebig Medal?,35,nobel,369,True,False,False,True,False,False,False,True,False,False,False,False,False,COUNT
528,528,how many spouses does Albert A. Michelson have?,2,nobel,370,False,True,False,False,False,False,False,True,False,False,False,False,False,COUNT
529,529,What award did Albert A. Michelson receive in 1907?,Nobel Prize in Physics,nobel,370,True,False,False,False,False,False,False,False,False,False,False,False,False,UNKNOWN
530,530,At what age Albert A. Michelson married his first wife Margaret Hemingway?,24,nobel,370,False,True,False,False,False,False,True,False,False,False,False,False,True,AGE
531,531,How many children's does Albert A. Michelson have in total?,6,nobel,370,False,True,False,False,False,False,False,True,True,False,False,False,False,COUNT
532,532,When did Albert A. Michelson marry Edna Stanton?,1899,nobel,370,False,True,False,False,False,False,False,False,False,False,False,False,False,TEMPORAL
533,533,How many children did he  have?,6,nobel,370,False,True,False,False,False,False,False,True,False,False,False,False,False,COUNT
534,534,How old was he when he won the Nobel Prize?,55,nobel,370,False,True,False,False,False,False,False,False,False,False,False,False,False,AGE
535,535,What was the name of the spouse Albert A. Michelson married in 1877?,Margaret Hemingway,nobel,370,True,False,False,False,False,False,False,False,False,False,False,False,False,UNKNOWN
536,536,At what age Albert A. Michelson die?,78,nobel,370,False,True,False,False,False,False,False,False,False,False,False,False,False,AGE
537,537,How many children's does Albert A. Michelson have?,6,nobel,370,False,True,False,False,False,False,False,True,False,False,False,False,False,COUNT
538,538,How many years after his divorce did Albert A. Michelson get remarried?,1 year,nobel,370,True,False,False,True,False,False,False,True,False,False,False,False,False,TEMPORAL
539,539,At what age Albert A. Michelson married his second wife Edna Stanton?,46,nobel,370,False,True,False,False,False,False,False,False,False,False,False,False,True,AGE
540,540,How old was Albert A. Michelson when he got married for the first time?,25 years old,nobel,370,False,True,False,False,False,False,False,False,False,False,False,False,True,TEMPORAL
541,541,Who was Albert A. Michelson married to when he won the Nobel Prize in Physics?,Edna Stanton,nobel,370,False,True,False,False,False,False,False,False,False,False,False,False,False,PERSON
542,542,How many years between his first award and last award?,26,nobel,370,True,False,True,False,True,False,False,True,False,False,False,False,True,COUNT
543,543,What MLB team did Art Wilson spend the most time playing for?,New York Giants,baseball,400,True,False,False,False,False,True,False,False,False,False,False,False,False,ORGANIZATION
544,544,What year did Art Wilson play for the Cleveland Indians?,1921,baseball,400,True,False,False,False,False,False,False,False,False,False,False,False,False,TEMPORAL
545,545,How old was Art Wilson when he made his MLB debut in 1908?,23 years old,baseball,400,True,False,False,False,False,False,False,False,False,False,False,False,False,TEMPORAL
546,546,How much longer did Wilson play for the New York Giants than the Boston Braves?,3 years,baseball,400,False,True,False,False,True,False,False,False,False,False,False,False,False,TEMPORAL
547,547,How long after his last MLB appearance did Wilson die?,39 years,baseball,400,False,True,True,True,False,False,False,False,False,False,False,False,True,TEMPORAL
548,548,What was the first team in the Major League that Art Wilson played for?,New York Giants,baseball,400,False,True,False,False,False,False,False,False,False,False,False,False,True,ORGANIZATION
549,549,How many years did Art Wilson play for MLB?,13 years,baseball,400,True,False,False,False,False,False,False,True,False,False,False,False,False,TEMPORAL
550,550,How many years after his MLB debut did Art Wilson play for the Pittsburgh Pirates?,8,baseball,400,True,False,False,True,False,False,False,True,False,False,False,False,False,COUNT
551,551,What was Art Wilson's last year playing in the Major League?,1921,baseball,400,True,False,True,False,False,False,False,False,False,False,False,False,True,UNKNOWN
552,552,How many years did Babe Young play for MLB?,12 years,baseball,401,True,False,False,False,False,False,False,True,False,False,False,False,False,TEMPORAL
553,553,How old was Young when he made his MLB debut?,21,baseball,401,False,True,False,False,False,False,False,False,False,False,False,False,False,AGE
554,554,How many years longer did Young play for the New York Giants the second time than for the Cincinnati Reds?,2,baseball,401,True,False,False,False,True,False,False,True,False,False,False,False,True,COUNT
555,555,How many years after his final MLB appearance did Young die?,35,baseball,401,True,False,False,True,False,False,False,True,False,False,False,False,False,COUNT
556,556,What year did Babe Young make his MBL debut?,1936,baseball,401,True,False,False,False,False,False,False,False,False,False,False,False,False,TEMPORAL
557,557,Which team did Babe Young was represented in 1940?,New York Giants,baseball,401,True,False,False,False,False,False,False,False,False,False,False,False,False,ORGANIZATION
558,558,How old was Babe Young when he began his career with MLB?,21 years old,baseball,401,False,True,False,False,False,False,False,False,False,False,False,False,False,TEMPORAL
559,559,How many years did Babe Young was played for Cincinnati Reds?,2 Years,baseball,401,True,False,False,False,False,False,False,True,False,False,False,False,False,TEMPORAL
560,560,What was the age of Babe Young When he played MLB debut?,Age of 21,baseball,401,False,True,False,False,False,False,False,False,False,False,False,False,False,AGE
561,561,How long after McCoy made his last MLB appearance did he die?,70 years,baseball,405,False,True,True,True,False,False,False,False,False,False,False,False,True,TEMPORAL
562,562,How long after making his MLB debut did McCoy play for the Philadelphia Athletics?,2 years,baseball,405,False,True,False,True,False,False,False,False,False,False,False,False,False,TEMPORAL
563,563,How old was McCoy when he made his MLB debut?,23,baseball,405,False,True,False,False,False,False,False,False,False,False,False,False,False,AGE
564,564,What was the first professional baseball team that Benny McCoy played for?,Detroit Tigers,baseball,405,False,True,False,False,False,False,False,False,False,False,False,False,True,UNKNOWN
565,565,For how many years did Benny McCoy play professional baseball?,3,baseball,405,True,False,False,False,True,False,False,True,False,False,False,False,False,COUNT
566,566,How many total years did Benny McCoy for MLB?,3 years,baseball,405,True,False,False,False,False,False,False,True,True,False,False,False,False,TEMPORAL
567,567,When was the last season that Benny McCoy played professionally?,1941,baseball,405,True,False,True,False,False,False,False,False,False,False,False,False,True,TEMPORAL
568,568,How old was Benny McCoy when he made his MLB debut?,23 years old,baseball,405,False,True,False,False,False,False,False,False,False,False,False,False,False,TEMPORAL
569,569,How may years did Benny McCoy play for the Detroit Tigers?,1 year,baseball,405,True,False,False,False,False,False,False,False,False,False,False,False,False,TEMPORAL
570,570,How many years ago did Current constitution was established in Brazil?,34 Years ago (1988),country,424,True,False,True,False,False,False,False,True,False,False,False,False,False,TEMPORAL
571,571,How many years ago did Brazil was declared as republic?,133 years ago (1889),country,424,True,False,True,False,False,False,False,True,False,False,False,False,False,TEMPORAL
572,572,Who was the most Ethnic groups in Federative Republic of Brazil 2010?,White (47.73%),country,424,True,False,False,False,False,True,False,False,False,False,False,False,False,PERCENTAGE
